{
  "id": "barmenia-gothaer-basisrente",
  "category": "life",
  "subCategory": "pension-ruerup",
  "productLines": [
    "ruerup",
    "fondsgebunden"
  ],
  "taxFavored": true,
  "provider": "Barmenia/Gothaer",
  "name": "Rürup Basisrente",
  "shortDescription": "Rürup-Basisrente der Barmenia/Gothaer-Gruppe mit garantierter Verrentung und Sonderausgabenabzug.",
  "minPremium": 50,
  "entryAge": {
    "min": 16,
    "max": 65
  },
  "term": {
    "min": 12,
    "max": 67
  },
  "guaranteedAnnuityFactor": 25.42,
  "currentAnnuityFactor": 25.39,
  "costStructure": {
    "abschlusskosten": 2.5,
    "jaehrlicheKosten": 16.5,
    "verwaltungskosten": 0,
    "zuzahlungAbschlusskosten": 2.5,
    "vertriebswegEinmalprozent": 2.5,
    "verrentungskosten": 0.019,
    "abschlusskostenVerteilungsdauer": 5,
    "zillmerdauer": 100,
    "stueckkosten": 30
  },
  "features": [
    "Sonderausgabenabzug nach § 10 EStG (94 % in 2026)",
    "Garantierter Rentenfaktor: 25,42 EUR / 10.000 EUR",
    "Aktueller Rentenfaktor: 25,39 EUR / 10.000 EUR",
    "Lebenslange Rente garantiert"
  ],
  "tags": [
    "altersvorsorge",
    "ruerup",
    "vergleich-w"
  ]
}
