{
  "id": "universa-topinvest",
  "category": "life",
  "subCategory": "pension-private",
  "productLines": ["fondsgebunden"],
  "provider": "Universa",
  "name": "topinvest",
  "shortDescription": "Fondsgebundene Rentenversicherung der Universa mit übersichtlicher Fondsauswahl und solider Hochrechnung in der konservativen Mittelschicht.",
  "minPremium": 25,
  "entryAge": { "min": 0, "max": 70 },
  "term": { "min": 5, "max": 50 },
  "effectiveCost": 1.6,
  "guaranteedAnnuityFactor": 21,
  "fundSelection": { "etfCount": 15, "fundCount": 50, "sustainableAvailable": true },
  "flexibility": { "minAdditionalPayment": 50, "freeWithdrawalsPerYear": 2, "contributionFreezeAllowed": true, "freeFundSwitchesPerYear": 12 },
  "scenarios": [
    { "id": "with-surplus", "label": "Hochrechnung inkl. Überschussbeteiligung", "guaranteedAnnuityFactor": 29 }
  ],
  "features": [
    "50 Fonds inkl. 15 ETFs",
    "Solide Universa-Hochrechnung",
    "Beitragsgarantie wählbar",
    "Hinterbliebenenschutz optional"
  ],
  "tags": ["altersvorsorge", "fondsgebunden"]
}
