{
  "id": "hansemerkur-basisrente",
  "category": "life",
  "subCategory": "pension-ruerup",
  "productLines": [
    "ruerup",
    "fondsgebunden"
  ],
  "taxFavored": true,
  "provider": "HanseMerkur",
  "name": "Basisrente",
  "shortDescription": "Rürup-Basisrente der HanseMerkur mit niedrigen Verwaltungskosten und attraktivem aktuellem Rentenfaktor (30,24).",
  "minPremium": 50,
  "entryAge": {
    "min": 16,
    "max": 65
  },
  "term": {
    "min": 12,
    "max": 67
  },
  "guaranteedAnnuityFactor": 25.7,
  "currentAnnuityFactor": 30.24,
  "costStructure": {
    "abschlusskosten": 2.5,
    "jaehrlicheKosten": 7.66,
    "verwaltungskosten": 0.192,
    "zuzahlungAbschlusskosten": 2.5,
    "vertriebswegEinmalprozent": 2,
    "verrentungskosten": 0.01,
    "abschlusskostenVerteilungsdauer": 5,
    "zillmerdauer": 100,
    "stueckkosten": 12
  },
  "features": [
    "Sonderausgabenabzug nach § 10 EStG (94 % in 2026)",
    "Garantierter Rentenfaktor: 25,70 EUR / 10.000 EUR",
    "Aktueller Rentenfaktor: 30,24 EUR / 10.000 EUR",
    "Lebenslange Rente garantiert"
  ],
  "tags": [
    "altersvorsorge",
    "ruerup",
    "vergleich-w"
  ]
}
