{
  "id": "lv1871-basisrente",
  "category": "life",
  "subCategory": "pension-ruerup",
  "productLines": [
    "ruerup",
    "fondsgebunden"
  ],
  "taxFavored": true,
  "provider": "LV 1871",
  "name": "Mein Plan Basis",
  "shortDescription": "Rürup-Basisrente der LV 1871 mit transparenter Kostenstruktur und garantiertem Rentenfaktor 26,33.",
  "minPremium": 50,
  "entryAge": {
    "min": 16,
    "max": 65
  },
  "term": {
    "min": 12,
    "max": 67
  },
  "guaranteedAnnuityFactor": 26.33,
  "currentAnnuityFactor": 28.47,
  "costStructure": {
    "abschlusskosten": 2.57,
    "jaehrlicheKosten": 8.4,
    "verwaltungskosten": 0.3,
    "zuzahlungAbschlusskosten": 2.5,
    "vertriebswegEinmalprozent": 3,
    "verrentungskosten": 0.015,
    "abschlusskostenVerteilungsdauer": 5,
    "zillmerdauer": 100,
    "verwaltungskostenMinAbsolut": 30
  },
  "features": [
    "Sonderausgabenabzug nach § 10 EStG (94 % in 2026)",
    "Garantierter Rentenfaktor: 26,33 EUR / 10.000 EUR",
    "Aktueller Rentenfaktor: 28,47 EUR / 10.000 EUR",
    "Lebenslange Rente garantiert"
  ],
  "tags": [
    "altersvorsorge",
    "ruerup",
    "vergleich-w"
  ]
}
